{
  "schema": "aessf.dev/aem/v0",
  "id": "com.example.echo-server",
  "type": "mcp-server",
  "version": "0.1.0",
  "permissions": {
    "files": {
      "read": [],
      "write": []
    },
    "network": {
      "domains": [],
      "allow_ip_literals": false
    },
    "process": {
      "allow_shell": false,
      "allow_subprocess": true
    }
  }
}
