{
  "schema": "aessf.dev/aem/v0",
  "id": "com.example.web-fetcher",
  "type": "skill",
  "version": "0.1.0",
  "permissions": {
    "files": {
      "read": [],
      "write": []
    },
    "network": {
      "domains": ["api.example.com"],
      "allow_ip_literals": false
    },
    "process": {
      "allow_shell": true,
      "allow_subprocess": true
    }
  }
}
